contents,outline,outline_time,point_outlines,point_time,points,request,response,stage,text
"[""1. Prioritize tasks. Effective time management starts with prioritizing tasks based on their importance and urgency. By prioritizing tasks, you can focus on the most critical tasks first and avoid wasting time on non-essential tasks, which can help you manage your time more efficiently."", ""2. Set goals and deadlines. Establishing clear goals and deadlines helps you prioritize tasks and allocate your time effectively. By setting deadlines, you create a sense of urgency and focus, which can help you stay on track and avoid procrastination."", ""3. Use a planner or calendar. Staying organized and on top of your tasks is crucial to effective time management. Using a planner or calendar can help you keep track of your appointments, deadlines, and to-do lists, allowing you to prioritize your tasks and manage your time more efficiently."", ""4. Avoid multitasking. Multitasking can be a significant time management killer as it can lead to decreased productivity, increased stress, and a higher likelihood of mistakes. By focusing on one task at a time, you can complete each task more efficiently and effectively, allowing you to manage your time more productively."", ""5. Eliminate distractions. To improve your time management skills, it is essential to eliminate distractions that may hinder your productivity. Identify the things that distract you the most, such as social media, email notifications, or chatty coworkers, and find ways to minimize their impact on your work. By focusing on the task at hand, you can work more efficiently and effectively."", ""6. Learn to say no. By learning to say no to non-essential tasks and commitments, you can free up time and energy to focus on your priorities. By being mindful of your limits and setting boundaries, you can avoid overcommitting and feeling overwhelmed.""]"," 1. Prioritize tasks.
2. Set goals and deadlines.
3. Use a planner or calendar.
4. Avoid multitasking.
5. Eliminate distractions.
6. Learn to say no.",1.9688603515625,"[""Prioritize tasks."", ""Set goals and deadlines."", ""Use a planner or calendar."", ""Avoid multitasking."", ""Eliminate distractions."", ""Learn to say no.""]",2.39287939453125,"[""1"", ""2"", ""3"", ""4"", ""5"", ""6""]",How can I improve my time management skills?,"1. Prioritize tasks. Effective time management starts with prioritizing tasks based on their importance and urgency. By prioritizing tasks, you can focus on the most critical tasks first and avoid wasting time on non-essential tasks, which can help you manage your time more efficiently.
2. Set goals and deadlines. Establishing clear goals and deadlines helps you prioritize tasks and allocate your time effectively. By setting deadlines, you create a sense of urgency and focus, which can help you stay on track and avoid procrastination.
3. Use a planner or calendar. Staying organized and on top of your tasks is crucial to effective time management. Using a planner or calendar can help you keep track of your appointments, deadlines, and to-do lists, allowing you to prioritize your tasks and manage your time more efficiently.
4. Avoid multitasking. Multitasking can be a significant time management killer as it can lead to decreased productivity, increased stress, and a higher likelihood of mistakes. By focusing on one task at a time, you can complete each task more efficiently and effectively, allowing you to manage your time more productively.
5. Eliminate distractions. To improve your time management skills, it is essential to eliminate distractions that may hinder your productivity. Identify the things that distract you the most, such as social media, email notifications, or chatty coworkers, and find ways to minimize their impact on your work. By focusing on the task at hand, you can work more efficiently and effectively.
6. Learn to say no. By learning to say no to non-essential tasks and commitments, you can free up time and energy to focus on your priorities. By being mindful of your limits and setting boundaries, you can avoid overcommitting and feeling overwhelmed.",summarize,"1. Prioritize tasks. Effective time management starts with prioritizing tasks based on their importance and urgency. By prioritizing tasks, you can focus on the most critical tasks first and avoid wasting time on non-essential tasks, which can help you manage your time more efficiently.
2. Set goals and deadlines. Establishing clear goals and deadlines helps you prioritize tasks and allocate your time effectively. By setting deadlines, you create a sense of urgency and focus, which can help you stay on track and avoid procrastination.
3. Use a planner or calendar. Staying organized and on top of your tasks is crucial to effective time management. Using a planner or calendar can help you keep track of your appointments, deadlines, and to-do lists, allowing you to prioritize your tasks and manage your time more efficiently.
4. Avoid multitasking. Multitasking can be a significant time management killer as it can lead to decreased productivity, increased stress, and a higher likelihood of mistakes. By focusing on one task at a time, you can complete each task more efficiently and effectively, allowing you to manage your time more productively.
5. Eliminate distractions. To improve your time management skills, it is essential to eliminate distractions that may hinder your productivity. Identify the things that distract you the most, such as social media, email notifications, or chatty coworkers, and find ways to minimize their impact on your work. By focusing on the task at hand, you can work more efficiently and effectively.
6. Learn to say no. By learning to say no to non-essential tasks and commitments, you can free up time and energy to focus on your priorities. By being mindful of your limits and setting boundaries, you can avoid overcommitting and feeling overwhelmed."
"[""1. Deep breathing exercises. Breathing exercises can help reduce stress by slowing down the body's \""fight or flight\"" response, which can help individuals feel more calm and centered. By taking slow, deep breaths, individuals can promote relaxation and reduce feelings of anxiety and tension."", ""2. Meditation. Meditation is an effective way to manage stress as it helps to calm the mind and reduce emotional turmoil. Regular meditation practice can lead to increased self-awareness, improved emotional regulation, and a greater sense of inner peace."", ""3. Exercise regularly. Exercise is a powerful stress-reliever that can help reduce anxiety and tension by releasing endorphins, which are the body's natural mood-boosters. Engaging in physical activity, such as running, yoga, or swimming, can help distract from stressful thoughts and provide a sense of well-being."", ""4. Time management. Time management is an effective way to deal with stress as it helps to prioritize tasks and allocate time effectively, reducing the feeling of being overwhelmed and allowing for a more manageable workload. By prioritizing tasks and breaking them down into smaller, more manageable chunks, individuals can reduce their stress levels and feel more in control of their workload."", ""5. Prioritize tasks. Prioritizing tasks can help individuals manage their workload and reduce stress by focusing on the most important tasks first. By prioritizing tasks, individuals can avoid feeling overwhelmed and ensure that they are completing the most critical tasks, which can lead to a greater sense of accomplishment and reduced stress levels."", ""6. Seek support. One effective way to deal with stress is to seek support from friends, family, or a therapist. Talking to someone about your stressors and feelings can help you gain a different perspective and feel less alone in managing your stress.""]"," 1. Deep breathing exercises.
2. Meditation.
3. Exercise regularly.
4. Time management.
5. Prioritize tasks.
6. Seek support.",1.1744241943359375,"[""Deep breathing exercises."", ""Meditation."", ""Exercise regularly."", ""Time management."", ""Prioritize tasks."", ""Seek support.""]",2.301232177734375,"[""1"", ""2"", ""3"", ""4"", ""5"", ""6""]",What are the most effective ways to deal with stress?,"1. Deep breathing exercises. Breathing exercises can help reduce stress by slowing down the body's ""fight or flight"" response, which can help individuals feel more calm and centered. By taking slow, deep breaths, individuals can promote relaxation and reduce feelings of anxiety and tension.
2. Meditation. Meditation is an effective way to manage stress as it helps to calm the mind and reduce emotional turmoil. Regular meditation practice can lead to increased self-awareness, improved emotional regulation, and a greater sense of inner peace.
3. Exercise regularly. Exercise is a powerful stress-reliever that can help reduce anxiety and tension by releasing endorphins, which are the body's natural mood-boosters. Engaging in physical activity, such as running, yoga, or swimming, can help distract from stressful thoughts and provide a sense of well-being.
4. Time management. Time management is an effective way to deal with stress as it helps to prioritize tasks and allocate time effectively, reducing the feeling of being overwhelmed and allowing for a more manageable workload. By prioritizing tasks and breaking them down into smaller, more manageable chunks, individuals can reduce their stress levels and feel more in control of their workload.
5. Prioritize tasks. Prioritizing tasks can help individuals manage their workload and reduce stress by focusing on the most important tasks first. By prioritizing tasks, individuals can avoid feeling overwhelmed and ensure that they are completing the most critical tasks, which can lead to a greater sense of accomplishment and reduced stress levels.
6. Seek support. One effective way to deal with stress is to seek support from friends, family, or a therapist. Talking to someone about your stressors and feelings can help you gain a different perspective and feel less alone in managing your stress.",summarize,"1. Deep breathing exercises. Breathing exercises can help reduce stress by slowing down the body's ""fight or flight"" response, which can help individuals feel more calm and centered. By taking slow, deep breaths, individuals can promote relaxation and reduce feelings of anxiety and tension.
2. Meditation. Meditation is an effective way to manage stress as it helps to calm the mind and reduce emotional turmoil. Regular meditation practice can lead to increased self-awareness, improved emotional regulation, and a greater sense of inner peace.
3. Exercise regularly. Exercise is a powerful stress-reliever that can help reduce anxiety and tension by releasing endorphins, which are the body's natural mood-boosters. Engaging in physical activity, such as running, yoga, or swimming, can help distract from stressful thoughts and provide a sense of well-being.
4. Time management. Time management is an effective way to deal with stress as it helps to prioritize tasks and allocate time effectively, reducing the feeling of being overwhelmed and allowing for a more manageable workload. By prioritizing tasks and breaking them down into smaller, more manageable chunks, individuals can reduce their stress levels and feel more in control of their workload.
5. Prioritize tasks. Prioritizing tasks can help individuals manage their workload and reduce stress by focusing on the most important tasks first. By prioritizing tasks, individuals can avoid feeling overwhelmed and ensure that they are completing the most critical tasks, which can lead to a greater sense of accomplishment and reduced stress levels.
6. Seek support. One effective way to deal with stress is to seek support from friends, family, or a therapist. Talking to someone about your stressors and feelings can help you gain a different perspective and feel less alone in managing your stress."
"[""1. Syntax differences. Python and JavaScript have distinct syntax structures, with Python using indentation to denote block-level structure and curly braces to define code blocks, while JavaScript uses curly braces to define code blocks and semicolons to terminate statements."", ""2. Dynamic vs. static typing. Python is dynamically typed, which means that variable types are determined at runtime, whereas JavaScript is statically typed, where variable types are determined at compile-time. This difference in typing systems can affect how code is written and maintained, with Python requiring less explicit type annotations than JavaScript."", ""3. Object-oriented programming. Python is a fully object-oriented language, with supports for classes, objects, inheritance, and polymorphism. JavaScript, on the other hand, is a prototypal language, with a more lightweight and flexible object model, where objects can be created dynamically and inherit properties from other objects."", ""4. Built-in data types. Python and JavaScript have different built-in data types. Python has a more comprehensive set of built-in data types, including lists, dictionaries, sets, and tuples, which are commonly used in Python programming. In contrast, JavaScript has a more limited set of built-in data types, with a focus on variables, arrays, and objects."", ""5. Functional programming. Python is more inclined towards functional programming, with features like lambdas, map, filter, and reduce built into the language. JavaScript, on the other hand, has limited support for functional programming, but it can be achieved through libraries like Lodash or Underscore.""]"," 1. Syntax differences.
2. Dynamic vs. static typing.
3. Object-oriented programming.
4. Built-in data types.
5. Functional programming.",1.02953369140625,"[""Syntax differences."", ""Dynamic vs. static typing."", ""Object-oriented programming."", ""Built-in data types."", ""Functional programming.""]",2.2650029296875,"[""1"", ""2"", ""3"", ""4"", ""5""]",What are the main differences between Python and JavaScript programming languages?,"1. Syntax differences. Python and JavaScript have distinct syntax structures, with Python using indentation to denote block-level structure and curly braces to define code blocks, while JavaScript uses curly braces to define code blocks and semicolons to terminate statements.
2. Dynamic vs. static typing. Python is dynamically typed, which means that variable types are determined at runtime, whereas JavaScript is statically typed, where variable types are determined at compile-time. This difference in typing systems can affect how code is written and maintained, with Python requiring less explicit type annotations than JavaScript.
3. Object-oriented programming. Python is a fully object-oriented language, with supports for classes, objects, inheritance, and polymorphism. JavaScript, on the other hand, is a prototypal language, with a more lightweight and flexible object model, where objects can be created dynamically and inherit properties from other objects.
4. Built-in data types. Python and JavaScript have different built-in data types. Python has a more comprehensive set of built-in data types, including lists, dictionaries, sets, and tuples, which are commonly used in Python programming. In contrast, JavaScript has a more limited set of built-in data types, with a focus on variables, arrays, and objects.
5. Functional programming. Python is more inclined towards functional programming, with features like lambdas, map, filter, and reduce built into the language. JavaScript, on the other hand, has limited support for functional programming, but it can be achieved through libraries like Lodash or Underscore.",summarize,"1. Syntax differences. Python and JavaScript have distinct syntax structures, with Python using indentation to denote block-level structure and curly braces to define code blocks, while JavaScript uses curly braces to define code blocks and semicolons to terminate statements.
2. Dynamic vs. static typing. Python is dynamically typed, which means that variable types are determined at runtime, whereas JavaScript is statically typed, where variable types are determined at compile-time. This difference in typing systems can affect how code is written and maintained, with Python requiring less explicit type annotations than JavaScript.
3. Object-oriented programming. Python is a fully object-oriented language, with supports for classes, objects, inheritance, and polymorphism. JavaScript, on the other hand, is a prototypal language, with a more lightweight and flexible object model, where objects can be created dynamically and inherit properties from other objects.
4. Built-in data types. Python and JavaScript have different built-in data types. Python has a more comprehensive set of built-in data types, including lists, dictionaries, sets, and tuples, which are commonly used in Python programming. In contrast, JavaScript has a more limited set of built-in data types, with a focus on variables, arrays, and objects.
5. Functional programming. Python is more inclined towards functional programming, with features like lambdas, map, filter, and reduce built into the language. JavaScript, on the other hand, has limited support for functional programming, but it can be achieved through libraries like Lodash or Underscore."
"[""1. Create a dedicated workspace. Establishing a designated area for work can help create a clear boundary between work and personal life, improving focus and productivity. This space should be comfortable, well-lit, and free from distractions, such as television or social media."", ""2. Set a routine and stick to it. Establishing a consistent daily routine can help you stay focused and productive while working from home. This can include setting specific work hours, taking regular breaks, and engaging in activities that help you recharge and refocus."", ""3. Minimize distractions. To minimize distractions while working from home, it's essential to create a conducive work environment. This can be achieved by eliminating or limiting sources of distractions such as turning off notifications on electronic devices, closing unnecessary tabs on your computer, and finding a quiet workspace."", ""4. Take breaks and practice self-care. It's important to take breaks throughout the day to recharge and avoid burnout. Schedule breaks into your day, such as a 10-minute walk or a quick meditation session, to help you stay focused and productive."", ""5. Stay organized and prioritize tasks. To increase productivity while working from home, it's essential to stay organized and prioritize tasks effectively. This means using tools such as to-do lists, calendars, and project management software to keep track of tasks and deadlines, and prioritizing tasks based on their importance and urgency."", ""6. Establish boundaries with family and friends. It is essential to communicate your work hours and boundaries clearly to avoid interruptions and ensure a productive work environment. Setting clear expectations with loved ones can help you maintain focus and avoid feelings of guilt or obligation that may hinder your productivity.""]"," 1. Create a dedicated workspace.
2. Set a routine and stick to it.
3. Minimize distractions.
4. Take breaks and practice self-care.
5. Stay organized and prioritize tasks.
6. Establish boundaries with family and friends.",1.6720701904296875,"[""Create a dedicated workspace."", ""Set a routine and stick to it."", ""Minimize distractions."", ""Take breaks and practice self-care."", ""Stay organized and prioritize tasks."", ""Establish boundaries with family and friends.""]",1.8931529541015626,"[""1"", ""2"", ""3"", ""4"", ""5"", ""6""]",How can I increase my productivity while working from home?,"1. Create a dedicated workspace. Establishing a designated area for work can help create a clear boundary between work and personal life, improving focus and productivity. This space should be comfortable, well-lit, and free from distractions, such as television or social media.
2. Set a routine and stick to it. Establishing a consistent daily routine can help you stay focused and productive while working from home. This can include setting specific work hours, taking regular breaks, and engaging in activities that help you recharge and refocus.
3. Minimize distractions. To minimize distractions while working from home, it's essential to create a conducive work environment. This can be achieved by eliminating or limiting sources of distractions such as turning off notifications on electronic devices, closing unnecessary tabs on your computer, and finding a quiet workspace.
4. Take breaks and practice self-care. It's important to take breaks throughout the day to recharge and avoid burnout. Schedule breaks into your day, such as a 10-minute walk or a quick meditation session, to help you stay focused and productive.
5. Stay organized and prioritize tasks. To increase productivity while working from home, it's essential to stay organized and prioritize tasks effectively. This means using tools such as to-do lists, calendars, and project management software to keep track of tasks and deadlines, and prioritizing tasks based on their importance and urgency.
6. Establish boundaries with family and friends. It is essential to communicate your work hours and boundaries clearly to avoid interruptions and ensure a productive work environment. Setting clear expectations with loved ones can help you maintain focus and avoid feelings of guilt or obligation that may hinder your productivity.",summarize,"1. Create a dedicated workspace. Establishing a designated area for work can help create a clear boundary between work and personal life, improving focus and productivity. This space should be comfortable, well-lit, and free from distractions, such as television or social media.
2. Set a routine and stick to it. Establishing a consistent daily routine can help you stay focused and productive while working from home. This can include setting specific work hours, taking regular breaks, and engaging in activities that help you recharge and refocus.
3. Minimize distractions. To minimize distractions while working from home, it's essential to create a conducive work environment. This can be achieved by eliminating or limiting sources of distractions such as turning off notifications on electronic devices, closing unnecessary tabs on your computer, and finding a quiet workspace.
4. Take breaks and practice self-care. It's important to take breaks throughout the day to recharge and avoid burnout. Schedule breaks into your day, such as a 10-minute walk or a quick meditation session, to help you stay focused and productive.
5. Stay organized and prioritize tasks. To increase productivity while working from home, it's essential to stay organized and prioritize tasks effectively. This means using tools such as to-do lists, calendars, and project management software to keep track of tasks and deadlines, and prioritizing tasks based on their importance and urgency.
6. Establish boundaries with family and friends. It is essential to communicate your work hours and boundaries clearly to avoid interruptions and ensure a productive work environment. Setting clear expectations with loved ones can help you maintain focus and avoid feelings of guilt or obligation that may hinder your productivity."
