contents,outline,outline_time,point_outlines,point_time,points,request,response,stage,text
"[""1. Psychological factors. Watching horror movies or going on roller coasters can provide a form of psychological escape or distraction from one's own problems, allowing individuals to confront and process their fears in a controlled environment. Additionally, the adrenaline rush and increased heart rate associated with these activities can release endorphins, which can produce a sense of euphoria or relaxation."", ""2. Social bonding. Watching horror movies or going on roller coasters can be a social activity, and some people enjoy the shared experience and bonding that comes with it. Being scared together can create a sense of camaraderie and shared excitement that can strengthen relationships."", ""3. Release of endorphins. Watching horror movies or going on roller coasters can stimulate the release of endorphins, which are natural chemicals that can produce feelings of pleasure and relaxation. This can be explained by the fact that the brain's reward system is activated during these experiences, releasing endorphins as a way to reward the body for perceived danger."", ""4. Adrenaline rush. Watching horror movies or going on roller coasters can trigger the release of adrenaline, a hormone that enhances the body's response to stress. This rush can be enjoyable for some people, providing a thrilling and exhilarating experience."", ""5. Personal preferences. Some people may enjoy the sensation of being scared because it provides a thrilling and exhilarating experience that they find pleasurable. For example, some individuals may find the adrenaline rush associated with horror movies or roller coasters to be enjoyable and seek out these experiences for the thrill they provide."", ""6. Brain chemistry. Some people may enjoy the sensation of being scared due to the release of certain neurotransmitters, such as dopamine and endorphins, which can create feelings of pleasure and relaxation. These chemicals can be released in response to a variety of stimuli, including horror movies, roller coasters, and other thrill-seeking activities."", ""7. Genetic predisposition. Some people may be more prone to enjoying scary experiences due to their genetic makeup. For example, research has shown that certain genetic variations are associated with a greater preference for thrilling and suspenseful activities, such as horror movies and roller coasters."", ""8. Cultural influences. Cultural background and upbringing can play a significant role in determining why some people enjoy being scared. For instance, some cultures view horror movies as a way to experience catharsis and release tension, while others view them as a form of entertainment.""]"," 1. Psychological factors.
2. Social bonding.
3. Release of endorphins.
4. Adrenaline rush.
5. Personal preferences.
6. Brain chemistry.
7. Genetic predisposition.
8. Cultural influences.",1.6524503173828125,"[""Psychological factors."", ""Social bonding."", ""Release of endorphins."", ""Adrenaline rush."", ""Personal preferences."", ""Brain chemistry."", ""Genetic predisposition."", ""Cultural influences.""]",2.567242431640625,"[""1"", ""2"", ""3"", ""4"", ""5"", ""6"", ""7"", ""8""]","Why do some people enjoy the sensation of being scared, such as by watching horror movies or going on roller coasters, while others avoid these experiences?","1. Psychological factors. Watching horror movies or going on roller coasters can provide a form of psychological escape or distraction from one's own problems, allowing individuals to confront and process their fears in a controlled environment. Additionally, the adrenaline rush and increased heart rate associated with these activities can release endorphins, which can produce a sense of euphoria or relaxation.
2. Social bonding. Watching horror movies or going on roller coasters can be a social activity, and some people enjoy the shared experience and bonding that comes with it. Being scared together can create a sense of camaraderie and shared excitement that can strengthen relationships.
3. Release of endorphins. Watching horror movies or going on roller coasters can stimulate the release of endorphins, which are natural chemicals that can produce feelings of pleasure and relaxation. This can be explained by the fact that the brain's reward system is activated during these experiences, releasing endorphins as a way to reward the body for perceived danger.
4. Adrenaline rush. Watching horror movies or going on roller coasters can trigger the release of adrenaline, a hormone that enhances the body's response to stress. This rush can be enjoyable for some people, providing a thrilling and exhilarating experience.
5. Personal preferences. Some people may enjoy the sensation of being scared because it provides a thrilling and exhilarating experience that they find pleasurable. For example, some individuals may find the adrenaline rush associated with horror movies or roller coasters to be enjoyable and seek out these experiences for the thrill they provide.
6. Brain chemistry. Some people may enjoy the sensation of being scared due to the release of certain neurotransmitters, such as dopamine and endorphins, which can create feelings of pleasure and relaxation. These chemicals can be released in response to a variety of stimuli, including horror movies, roller coasters, and other thrill-seeking activities.
7. Genetic predisposition. Some people may be more prone to enjoying scary experiences due to their genetic makeup. For example, research has shown that certain genetic variations are associated with a greater preference for thrilling and suspenseful activities, such as horror movies and roller coasters.
8. Cultural influences. Cultural background and upbringing can play a significant role in determining why some people enjoy being scared. For instance, some cultures view horror movies as a way to experience catharsis and release tension, while others view them as a form of entertainment.",summarize,"1. Psychological factors. Watching horror movies or going on roller coasters can provide a form of psychological escape or distraction from one's own problems, allowing individuals to confront and process their fears in a controlled environment. Additionally, the adrenaline rush and increased heart rate associated with these activities can release endorphins, which can produce a sense of euphoria or relaxation.
2. Social bonding. Watching horror movies or going on roller coasters can be a social activity, and some people enjoy the shared experience and bonding that comes with it. Being scared together can create a sense of camaraderie and shared excitement that can strengthen relationships.
3. Release of endorphins. Watching horror movies or going on roller coasters can stimulate the release of endorphins, which are natural chemicals that can produce feelings of pleasure and relaxation. This can be explained by the fact that the brain's reward system is activated during these experiences, releasing endorphins as a way to reward the body for perceived danger.
4. Adrenaline rush. Watching horror movies or going on roller coasters can trigger the release of adrenaline, a hormone that enhances the body's response to stress. This rush can be enjoyable for some people, providing a thrilling and exhilarating experience.
5. Personal preferences. Some people may enjoy the sensation of being scared because it provides a thrilling and exhilarating experience that they find pleasurable. For example, some individuals may find the adrenaline rush associated with horror movies or roller coasters to be enjoyable and seek out these experiences for the thrill they provide.
6. Brain chemistry. Some people may enjoy the sensation of being scared due to the release of certain neurotransmitters, such as dopamine and endorphins, which can create feelings of pleasure and relaxation. These chemicals can be released in response to a variety of stimuli, including horror movies, roller coasters, and other thrill-seeking activities.
7. Genetic predisposition. Some people may be more prone to enjoying scary experiences due to their genetic makeup. For example, research has shown that certain genetic variations are associated with a greater preference for thrilling and suspenseful activities, such as horror movies and roller coasters.
8. Cultural influences. Cultural background and upbringing can play a significant role in determining why some people enjoy being scared. For instance, some cultures view horror movies as a way to experience catharsis and release tension, while others view them as a form of entertainment."
"[""1. Social cues. Observing the behavior of other people in a social situation can provide valuable clues about cultural norms and expectations by picking up on subtle cues such as body language, facial expressions, and tone of voice. These cues can indicate what is considered appropriate behavior in a particular culture, and can help individuals navigate unfamiliar social situations."", ""2. Nonverbal communication. Observing the nonverbal cues of others in a social situation, such as body language, facial expressions, and tone of voice, can provide valuable information about cultural norms and expectations. For example, in some cultures, direct eye contact is seen as a sign of respect, while in others it can be interpreted as aggressive or confrontational."", ""3. Group dynamics. Observing the behavior of others in a social situation can provide clues about cultural norms and expectations by revealing how individuals interact with each other within a group. For example, if a group of people are engaging in a particular behavior or activity, it may indicate that it is a cultural norm in that society. Additionally, the way that individuals within a group respond to and interact with each other can reveal information about power dynamics and role expectations."", ""4. Power dynamics. Observing the behavior of others in a social situation can provide clues about cultural norms and expectations by revealing the distribution of power within a group. For example, who is speaking the most, who is deferring to others, and who is taking charge can all indicate the cultural norms around authority and decision-making."", ""5. Role expectations. Observing the behavior of others in a social situation can provide clues about cultural norms and expectations by revealing the roles and expectations associated with different social positions. For example, in some cultures, the elderly are expected to take on a mentorship role and offer wisdom to younger generations, while in other cultures, children are expected to show respect and deference to their elders. By paying attention to these role expectations, individuals can gain a better understanding of the cultural norms and values that underlie social interactions.""]"," 1. Social cues.
2. Nonverbal communication.
3. Group dynamics.
4. Power dynamics.
5. Role expectations.",0.9197077026367187,"[""Social cues."", ""Nonverbal communication."", ""Group dynamics."", ""Power dynamics."", ""Role expectations.""]",3.3497392578125,"[""1"", ""2"", ""3"", ""4"", ""5""]",How can observing the behavior of other people in a social situation provide clues about cultural norms and expectations?,"1. Social cues. Observing the behavior of other people in a social situation can provide valuable clues about cultural norms and expectations by picking up on subtle cues such as body language, facial expressions, and tone of voice. These cues can indicate what is considered appropriate behavior in a particular culture, and can help individuals navigate unfamiliar social situations.
2. Nonverbal communication. Observing the nonverbal cues of others in a social situation, such as body language, facial expressions, and tone of voice, can provide valuable information about cultural norms and expectations. For example, in some cultures, direct eye contact is seen as a sign of respect, while in others it can be interpreted as aggressive or confrontational.
3. Group dynamics. Observing the behavior of others in a social situation can provide clues about cultural norms and expectations by revealing how individuals interact with each other within a group. For example, if a group of people are engaging in a particular behavior or activity, it may indicate that it is a cultural norm in that society. Additionally, the way that individuals within a group respond to and interact with each other can reveal information about power dynamics and role expectations.
4. Power dynamics. Observing the behavior of others in a social situation can provide clues about cultural norms and expectations by revealing the distribution of power within a group. For example, who is speaking the most, who is deferring to others, and who is taking charge can all indicate the cultural norms around authority and decision-making.
5. Role expectations. Observing the behavior of others in a social situation can provide clues about cultural norms and expectations by revealing the roles and expectations associated with different social positions. For example, in some cultures, the elderly are expected to take on a mentorship role and offer wisdom to younger generations, while in other cultures, children are expected to show respect and deference to their elders. By paying attention to these role expectations, individuals can gain a better understanding of the cultural norms and values that underlie social interactions.",summarize,"1. Social cues. Observing the behavior of other people in a social situation can provide valuable clues about cultural norms and expectations by picking up on subtle cues such as body language, facial expressions, and tone of voice. These cues can indicate what is considered appropriate behavior in a particular culture, and can help individuals navigate unfamiliar social situations.
2. Nonverbal communication. Observing the nonverbal cues of others in a social situation, such as body language, facial expressions, and tone of voice, can provide valuable information about cultural norms and expectations. For example, in some cultures, direct eye contact is seen as a sign of respect, while in others it can be interpreted as aggressive or confrontational.
3. Group dynamics. Observing the behavior of others in a social situation can provide clues about cultural norms and expectations by revealing how individuals interact with each other within a group. For example, if a group of people are engaging in a particular behavior or activity, it may indicate that it is a cultural norm in that society. Additionally, the way that individuals within a group respond to and interact with each other can reveal information about power dynamics and role expectations.
4. Power dynamics. Observing the behavior of others in a social situation can provide clues about cultural norms and expectations by revealing the distribution of power within a group. For example, who is speaking the most, who is deferring to others, and who is taking charge can all indicate the cultural norms around authority and decision-making.
5. Role expectations. Observing the behavior of others in a social situation can provide clues about cultural norms and expectations by revealing the roles and expectations associated with different social positions. For example, in some cultures, the elderly are expected to take on a mentorship role and offer wisdom to younger generations, while in other cultures, children are expected to show respect and deference to their elders. By paying attention to these role expectations, individuals can gain a better understanding of the cultural norms and values that underlie social interactions."
"[""1. Exploration for knowledge and understanding. The pursuit of space exploration can also be seen as a moral obligation to expand our understanding of the universe and its many mysteries. As the late Carl Sagan once said, \""Somewhere, something incredible is waiting to be known.\"" The more we explore, the more we will learn about the cosmos and our place within it, which can inform our values and ethics."", ""2. Potential resources and colonization. Exploring space can provide access to new resources, such as minerals and energy sources, that can help address Earth's pressing problems. By establishing colonies on other planets or moons, humanity can create new habitats for its citizens and ensure the survival of the species, even in the face of global catastrophes or planetary disasters."", ""3. Scientific and technological advancements. Exploring space can lead to significant scientific and technological advancements, as it presents opportunities for new discoveries and innovations. These advancements can have a ripple effect, benefiting not only space exploration but also Earth-based industries and society as a whole."", ""4. Potential risks and hazards. Exploring space also comes with potential risks and hazards, such as the exposure of astronauts to harmful radiation, the potential for catastrophic accidents during launch or re-entry, and the risk of contamination of other planets and celestial bodies with Earth-based organisms. These risks must be carefully assessed and mitigated in order to ensure the safety of both humans and the environment as we continue to explore and explore the vastness of space."", ""5. Ethical considerations and responsibilities. Exploring and colonizing space raises ethical questions about the impact of human activity on the environment and the potential for exploitation of resources. As a responsible and ethical society, we must consider the long-term consequences of our actions and ensure that our pursuit of space exploration does not come at the expense of the planet and its inhabitants.""]"," 1. Exploration for knowledge and understanding.
2. Potential resources and colonization.
3. Scientific and technological advancements.
4. Potential risks and hazards.
5. Ethical considerations and responsibilities.",1.485640869140625,"[""Exploration for knowledge and understanding."", ""Potential resources and colonization."", ""Scientific and technological advancements."", ""Potential risks and hazards."", ""Ethical considerations and responsibilities.""]",3.137417724609375,"[""1"", ""2"", ""3"", ""4"", ""5""]","Do we have a moral obligation to explore space, or should we focus on solving Earth's problems first?","1. Exploration for knowledge and understanding. The pursuit of space exploration can also be seen as a moral obligation to expand our understanding of the universe and its many mysteries. As the late Carl Sagan once said, ""Somewhere, something incredible is waiting to be known."" The more we explore, the more we will learn about the cosmos and our place within it, which can inform our values and ethics.
2. Potential resources and colonization. Exploring space can provide access to new resources, such as minerals and energy sources, that can help address Earth's pressing problems. By establishing colonies on other planets or moons, humanity can create new habitats for its citizens and ensure the survival of the species, even in the face of global catastrophes or planetary disasters.
3. Scientific and technological advancements. Exploring space can lead to significant scientific and technological advancements, as it presents opportunities for new discoveries and innovations. These advancements can have a ripple effect, benefiting not only space exploration but also Earth-based industries and society as a whole.
4. Potential risks and hazards. Exploring space also comes with potential risks and hazards, such as the exposure of astronauts to harmful radiation, the potential for catastrophic accidents during launch or re-entry, and the risk of contamination of other planets and celestial bodies with Earth-based organisms. These risks must be carefully assessed and mitigated in order to ensure the safety of both humans and the environment as we continue to explore and explore the vastness of space.
5. Ethical considerations and responsibilities. Exploring and colonizing space raises ethical questions about the impact of human activity on the environment and the potential for exploitation of resources. As a responsible and ethical society, we must consider the long-term consequences of our actions and ensure that our pursuit of space exploration does not come at the expense of the planet and its inhabitants.",summarize,"1. Exploration for knowledge and understanding. The pursuit of space exploration can also be seen as a moral obligation to expand our understanding of the universe and its many mysteries. As the late Carl Sagan once said, ""Somewhere, something incredible is waiting to be known."" The more we explore, the more we will learn about the cosmos and our place within it, which can inform our values and ethics.
2. Potential resources and colonization. Exploring space can provide access to new resources, such as minerals and energy sources, that can help address Earth's pressing problems. By establishing colonies on other planets or moons, humanity can create new habitats for its citizens and ensure the survival of the species, even in the face of global catastrophes or planetary disasters.
3. Scientific and technological advancements. Exploring space can lead to significant scientific and technological advancements, as it presents opportunities for new discoveries and innovations. These advancements can have a ripple effect, benefiting not only space exploration but also Earth-based industries and society as a whole.
4. Potential risks and hazards. Exploring space also comes with potential risks and hazards, such as the exposure of astronauts to harmful radiation, the potential for catastrophic accidents during launch or re-entry, and the risk of contamination of other planets and celestial bodies with Earth-based organisms. These risks must be carefully assessed and mitigated in order to ensure the safety of both humans and the environment as we continue to explore and explore the vastness of space.
5. Ethical considerations and responsibilities. Exploring and colonizing space raises ethical questions about the impact of human activity on the environment and the potential for exploitation of resources. As a responsible and ethical society, we must consider the long-term consequences of our actions and ensure that our pursuit of space exploration does not come at the expense of the planet and its inhabitants."
