contents,outline,outline_time,point_outlines,point_time,points,request,response,stage,text
"[""1. Cultural influences on food choices. Food choices are significantly shaped by cultural norms and values, including the types of foods consumed, cooking methods, and dining practices. For instance, some cultures place a strong emphasis on consuming traditional dishes, while others prioritize health and wellness. Understanding these cultural differences can help promote healthier diets by encouraging the consumption of nutrient-dense foods and limiting the intake of unhealthy options."", ""2. Social norms and peer pressure. Social norms play a significant role in shaping people's food choices, as individuals often conform to what is perceived as the norm in their social circles. Peer pressure can influence food choices, particularly among young people, who may feel pressure to eat certain foods or avoid others to fit in with their peers."", ""3. Economic factors and food affordability. The cost of food can significantly impact people's food choices, with those in lower socio-economic brackets often facing challenges in affording healthy and nutritious food options. This can lead to a diet composed mainly of cheaper, processed foods, which can contribute to poor health outcomes."", ""4. Marketing and advertising strategies. The food industry uses sophisticated marketing and advertising strategies to influence people's food choices, often targeting vulnerable populations such as children and low-income communities. These strategies can create unhealthy food preferences and habits, which can be difficult to change without interventions that promote healthier options and limit exposure to unhealthy marketing tactics."", ""5. Food availability and accessibility. The availability and accessibility of healthy food options are greatly influenced by cultural and social factors. In some communities, traditional foods may be more readily available than healthier alternatives, making it challenging to promote healthier diets. By increasing the availability of fresh produce and whole foods in underserved areas, and making healthy options more accessible, individuals are more likely to make healthier food choices."", ""6. Cultural and social identity and food choices. People's food choices are also influenced by their cultural and social identity, including their ethnicity, religion, and social class. For example, certain foods may be prohibited or preferred based on religious beliefs or cultural traditions, and individuals from different social classes may have different food preferences and access to food options."", ""7. Food education and literacy. Providing education and literacy programs on nutrition and healthy eating can help individuals make informed choices about their food intake. These programs can target various age groups, including children, adolescents, and adults, to promote healthy eating habits and reduce the prevalence of diet-related diseases."", ""8. Policy and regulations. Policy and regulations play a crucial role in shaping people's food choices by influencing the availability, affordability, and marketing of healthy food options. Governments can implement policies such as taxes on unhealthy foods, subsidies for healthy foods, and labeling regulations to promote healthier diets.""]"," 1. Cultural influences on food choices.
2. Social norms and peer pressure.
3. Economic factors and food affordability.
4. Marketing and advertising strategies.
5. Food availability and accessibility.
6. Cultural and social identity and food choices.
7. Food education and literacy.
8. Policy and regulations.",1.998800537109375,"[""Cultural influences on food choices."", ""Social norms and peer pressure."", ""Economic factors and food affordability."", ""Marketing and advertising strategies."", ""Food availability and accessibility."", ""Cultural and social identity and food choices."", ""Food education and literacy."", ""Policy and regulations.""]",3.000193359375,"[""1"", ""2"", ""3"", ""4"", ""5"", ""6"", ""7"", ""8""]","How do cultural, social, and economic factors influence people's food choices, and how can this knowledge be used to promote healthier diets?","1. Cultural influences on food choices. Food choices are significantly shaped by cultural norms and values, including the types of foods consumed, cooking methods, and dining practices. For instance, some cultures place a strong emphasis on consuming traditional dishes, while others prioritize health and wellness. Understanding these cultural differences can help promote healthier diets by encouraging the consumption of nutrient-dense foods and limiting the intake of unhealthy options.
2. Social norms and peer pressure. Social norms play a significant role in shaping people's food choices, as individuals often conform to what is perceived as the norm in their social circles. Peer pressure can influence food choices, particularly among young people, who may feel pressure to eat certain foods or avoid others to fit in with their peers.
3. Economic factors and food affordability. The cost of food can significantly impact people's food choices, with those in lower socio-economic brackets often facing challenges in affording healthy and nutritious food options. This can lead to a diet composed mainly of cheaper, processed foods, which can contribute to poor health outcomes.
4. Marketing and advertising strategies. The food industry uses sophisticated marketing and advertising strategies to influence people's food choices, often targeting vulnerable populations such as children and low-income communities. These strategies can create unhealthy food preferences and habits, which can be difficult to change without interventions that promote healthier options and limit exposure to unhealthy marketing tactics.
5. Food availability and accessibility. The availability and accessibility of healthy food options are greatly influenced by cultural and social factors. In some communities, traditional foods may be more readily available than healthier alternatives, making it challenging to promote healthier diets. By increasing the availability of fresh produce and whole foods in underserved areas, and making healthy options more accessible, individuals are more likely to make healthier food choices.
6. Cultural and social identity and food choices. People's food choices are also influenced by their cultural and social identity, including their ethnicity, religion, and social class. For example, certain foods may be prohibited or preferred based on religious beliefs or cultural traditions, and individuals from different social classes may have different food preferences and access to food options.
7. Food education and literacy. Providing education and literacy programs on nutrition and healthy eating can help individuals make informed choices about their food intake. These programs can target various age groups, including children, adolescents, and adults, to promote healthy eating habits and reduce the prevalence of diet-related diseases.
8. Policy and regulations. Policy and regulations play a crucial role in shaping people's food choices by influencing the availability, affordability, and marketing of healthy food options. Governments can implement policies such as taxes on unhealthy foods, subsidies for healthy foods, and labeling regulations to promote healthier diets.",summarize,"1. Cultural influences on food choices. Food choices are significantly shaped by cultural norms and values, including the types of foods consumed, cooking methods, and dining practices. For instance, some cultures place a strong emphasis on consuming traditional dishes, while others prioritize health and wellness. Understanding these cultural differences can help promote healthier diets by encouraging the consumption of nutrient-dense foods and limiting the intake of unhealthy options.
2. Social norms and peer pressure. Social norms play a significant role in shaping people's food choices, as individuals often conform to what is perceived as the norm in their social circles. Peer pressure can influence food choices, particularly among young people, who may feel pressure to eat certain foods or avoid others to fit in with their peers.
3. Economic factors and food affordability. The cost of food can significantly impact people's food choices, with those in lower socio-economic brackets often facing challenges in affording healthy and nutritious food options. This can lead to a diet composed mainly of cheaper, processed foods, which can contribute to poor health outcomes.
4. Marketing and advertising strategies. The food industry uses sophisticated marketing and advertising strategies to influence people's food choices, often targeting vulnerable populations such as children and low-income communities. These strategies can create unhealthy food preferences and habits, which can be difficult to change without interventions that promote healthier options and limit exposure to unhealthy marketing tactics.
5. Food availability and accessibility. The availability and accessibility of healthy food options are greatly influenced by cultural and social factors. In some communities, traditional foods may be more readily available than healthier alternatives, making it challenging to promote healthier diets. By increasing the availability of fresh produce and whole foods in underserved areas, and making healthy options more accessible, individuals are more likely to make healthier food choices.
6. Cultural and social identity and food choices. People's food choices are also influenced by their cultural and social identity, including their ethnicity, religion, and social class. For example, certain foods may be prohibited or preferred based on religious beliefs or cultural traditions, and individuals from different social classes may have different food preferences and access to food options.
7. Food education and literacy. Providing education and literacy programs on nutrition and healthy eating can help individuals make informed choices about their food intake. These programs can target various age groups, including children, adolescents, and adults, to promote healthy eating habits and reduce the prevalence of diet-related diseases.
8. Policy and regulations. Policy and regulations play a crucial role in shaping people's food choices by influencing the availability, affordability, and marketing of healthy food options. Governments can implement policies such as taxes on unhealthy foods, subsidies for healthy foods, and labeling regulations to promote healthier diets."
"[""1. Survival and reproduction. The process of natural selection is driven by the struggle for survival and reproduction among individuals in a population. Those individuals with traits that enhance their chances of survival and reproduction are more likely to pass those traits on to their offspring, while those without them are less likely to do so, leading to the evolution of the population over time."", ""2. Variation and inheritance. Natural selection relies on the idea that individuals with favorable traits are more likely to survive and reproduce, passing those traits on to their offspring. This means that variations in a population can be inherited from one generation to the next, providing the raw material for natural selection to act upon."", ""3. Selection and adaptation. Natural selection is the process by which organisms that are better adapted to their environment are more likely to survive and reproduce, passing on their advantageous traits to their offspring. This leads to the evolution of a population over time, as the individuals with the most advantageous traits become more common, while those with less advantageous traits become less common or even extinct."", ""4. Genetic drift. Genetic drift is a random process that can lead to the loss or fixation of alleles in a population over time. It occurs when a small group of individuals becomes isolated from the larger population and establishes a new population, leading to a loss of genetic variation and the potential for the fixation of neutral or slightly deleterious alleles."", ""5. Mutation and gene flow. Mutations, or changes in the DNA sequence of an organism, can also contribute to the evolution and adaptation of species. Gene flow, or the movement of genes from one population to another, can also play a role in shaping the evolution of a species by introducing new genetic variation.""]"," 1. Survival and reproduction.
2. Variation and inheritance.
3. Selection and adaptation.
4. Genetic drift.
5. Mutation and gene flow.",1.085180908203125,"[""Survival and reproduction."", ""Variation and inheritance."", ""Selection and adaptation."", ""Genetic drift."", ""Mutation and gene flow.""]",2.248717529296875,"[""1"", ""2"", ""3"", ""4"", ""5""]",Explain the process of natural selection and how it contributes to the evolution and adaptation of species.,"1. Survival and reproduction. The process of natural selection is driven by the struggle for survival and reproduction among individuals in a population. Those individuals with traits that enhance their chances of survival and reproduction are more likely to pass those traits on to their offspring, while those without them are less likely to do so, leading to the evolution of the population over time.
2. Variation and inheritance. Natural selection relies on the idea that individuals with favorable traits are more likely to survive and reproduce, passing those traits on to their offspring. This means that variations in a population can be inherited from one generation to the next, providing the raw material for natural selection to act upon.
3. Selection and adaptation. Natural selection is the process by which organisms that are better adapted to their environment are more likely to survive and reproduce, passing on their advantageous traits to their offspring. This leads to the evolution of a population over time, as the individuals with the most advantageous traits become more common, while those with less advantageous traits become less common or even extinct.
4. Genetic drift. Genetic drift is a random process that can lead to the loss or fixation of alleles in a population over time. It occurs when a small group of individuals becomes isolated from the larger population and establishes a new population, leading to a loss of genetic variation and the potential for the fixation of neutral or slightly deleterious alleles.
5. Mutation and gene flow. Mutations, or changes in the DNA sequence of an organism, can also contribute to the evolution and adaptation of species. Gene flow, or the movement of genes from one population to another, can also play a role in shaping the evolution of a species by introducing new genetic variation.",summarize,"1. Survival and reproduction. The process of natural selection is driven by the struggle for survival and reproduction among individuals in a population. Those individuals with traits that enhance their chances of survival and reproduction are more likely to pass those traits on to their offspring, while those without them are less likely to do so, leading to the evolution of the population over time.
2. Variation and inheritance. Natural selection relies on the idea that individuals with favorable traits are more likely to survive and reproduce, passing those traits on to their offspring. This means that variations in a population can be inherited from one generation to the next, providing the raw material for natural selection to act upon.
3. Selection and adaptation. Natural selection is the process by which organisms that are better adapted to their environment are more likely to survive and reproduce, passing on their advantageous traits to their offspring. This leads to the evolution of a population over time, as the individuals with the most advantageous traits become more common, while those with less advantageous traits become less common or even extinct.
4. Genetic drift. Genetic drift is a random process that can lead to the loss or fixation of alleles in a population over time. It occurs when a small group of individuals becomes isolated from the larger population and establishes a new population, leading to a loss of genetic variation and the potential for the fixation of neutral or slightly deleterious alleles.
5. Mutation and gene flow. Mutations, or changes in the DNA sequence of an organism, can also contribute to the evolution and adaptation of species. Gene flow, or the movement of genes from one population to another, can also play a role in shaping the evolution of a species by introducing new genetic variation."
"[""1. Chivalrous. As a medieval knight, I am honored to introduce myself with the utmost respect and courtesy, for it is my duty to uphold the code of chivalry and protect the realm with valor and nobility. With my armor shining bright and my sword at the ready, I pledge my loyalty to the king and queen, and to the noble guests gathered here tonight."", ""2. Brave. As a medieval knight, I am known for my fearlessness in battle and my unwavering courage in the face of danger. My loyalty to my lord and my kingdom is unshakeable, and I would lay down my life to protect them if necessary."", ""3. Loyal. As a medieval knight, I am unwaveringly loyal to my lord and king, pledging my sword and my life in service to their cause. My loyalty knows no bounds, and I will stand by my lord's side through thick and thin, come what may."", ""4. Honorable. As a medieval knight, I am a man of my word, bound by my code of chivalry to always act with integrity and honor. My loyalty to my lord and kingdom is unwavering, and I am prepared to lay down my life in defense of what is right and just."", ""5. Courteous. As a medieval knight, I would introduce myself with the utmost respect and courtesy towards the royal host and guests. With a bow and a smile, I would say, \""Your Highness, it is an honor to be in your presence. May I have the pleasure of dining with you this evening?\""""]"," 1. Chivalrous.
2. Brave.
3. Loyal.
4. Honorable.
5. Courteous.",0.8514995727539062,"[""Chivalrous."", ""Brave."", ""Loyal."", ""Honorable."", ""Courteous.""]",2.476908447265625,"[""1"", ""2"", ""3"", ""4"", ""5""]",How would you introduce yourself as a medieval knight at a royal banquet?,"1. Chivalrous. As a medieval knight, I am honored to introduce myself with the utmost respect and courtesy, for it is my duty to uphold the code of chivalry and protect the realm with valor and nobility. With my armor shining bright and my sword at the ready, I pledge my loyalty to the king and queen, and to the noble guests gathered here tonight.
2. Brave. As a medieval knight, I am known for my fearlessness in battle and my unwavering courage in the face of danger. My loyalty to my lord and my kingdom is unshakeable, and I would lay down my life to protect them if necessary.
3. Loyal. As a medieval knight, I am unwaveringly loyal to my lord and king, pledging my sword and my life in service to their cause. My loyalty knows no bounds, and I will stand by my lord's side through thick and thin, come what may.
4. Honorable. As a medieval knight, I am a man of my word, bound by my code of chivalry to always act with integrity and honor. My loyalty to my lord and kingdom is unwavering, and I am prepared to lay down my life in defense of what is right and just.
5. Courteous. As a medieval knight, I would introduce myself with the utmost respect and courtesy towards the royal host and guests. With a bow and a smile, I would say, ""Your Highness, it is an honor to be in your presence. May I have the pleasure of dining with you this evening?""",summarize,"1. Chivalrous. As a medieval knight, I am honored to introduce myself with the utmost respect and courtesy, for it is my duty to uphold the code of chivalry and protect the realm with valor and nobility. With my armor shining bright and my sword at the ready, I pledge my loyalty to the king and queen, and to the noble guests gathered here tonight.
2. Brave. As a medieval knight, I am known for my fearlessness in battle and my unwavering courage in the face of danger. My loyalty to my lord and my kingdom is unshakeable, and I would lay down my life to protect them if necessary.
3. Loyal. As a medieval knight, I am unwaveringly loyal to my lord and king, pledging my sword and my life in service to their cause. My loyalty knows no bounds, and I will stand by my lord's side through thick and thin, come what may.
4. Honorable. As a medieval knight, I am a man of my word, bound by my code of chivalry to always act with integrity and honor. My loyalty to my lord and kingdom is unwavering, and I am prepared to lay down my life in defense of what is right and just.
5. Courteous. As a medieval knight, I would introduce myself with the utmost respect and courtesy towards the royal host and guests. With a bow and a smile, I would say, ""Your Highness, it is an honor to be in your presence. May I have the pleasure of dining with you this evening?"""
